{"$schema":"https://json-schema.org/draft/2020-12/schema","$id":"https://hebrew-tty.local/schemas/terminal-screen-v1.json","title":"Terminal screen event fixture","type":"object","additionalProperties":false,"required":["schema_version","name","initial_size","events"],"properties":{"schema_version":{"const":1},"name":{"type":"string","minLength":1},"initial_size":{"$ref":"#/$defs/size"},"events":{"type":"array","minItems":1,"items":{"$ref":"#/$defs/event"}}},"$defs":{"size":{"type":"object","additionalProperties":false,"required":["rows","cols"],"properties":{"rows":{"type":"integer","minimum":1,"maximum":65535},"cols":{"type":"integer","minimum":1,"maximum":65535}}},"event":{"oneOf":[{"type":"object","additionalProperties":false,"required":["type","hex"],"properties":{"type":{"const":"feed"},"hex":{"type":"string","pattern":"^(?:[0-9a-f]{2})*$"}}},{"type":"object","additionalProperties":false,"required":["type","rows","cols"],"properties":{"type":{"const":"resize"},"rows":{"type":"integer","minimum":1},"cols":{"type":"integer","minimum":1}}},{"type":"object","additionalProperties":false,"required":["type","expected"],"properties":{"type":{"const":"checkpoint"},"expected":{"type":"object"}}},{"type":"object","additionalProperties":false,"required":["type","expected_indices"],"properties":{"type":{"const":"drain_dirty"},"expected_indices":{"type":"array","items":{"type":"integer","minimum":0}}}}]}}}
