{"schema_version":1,"name":"physical-rows-pane-divider-scroll-region","initial_size":{"rows":10,"cols":12},"events":[{"type":"drain_dirty","expected_indices":[0,1,2,3,4,5,6,7,8,9]},{"type":"feed","hex":"1b5b313b31484ce29482521b5b323b31484ce29482521b5b333b31484ce29482521b5b343b31484ce29482521b5b353b31484ce29482521b5b363b31484ce29482521b5b373b31484ce29482521b5b383b31484ce29482521b5b393b31484ce29482521b5b31303b31484ce29482521b5b323b34721b5b343b31480a"},{"type":"checkpoint","expected":{"rows":["L│R","L│R","L│R","","L│R","L│R","L│R","L│R","L│R","L│R"],"cursor":{"row":3,"col":0,"visible":true},"alternate_screen":false,"pane_spans":[{"start_col":0,"end_col":1},{"start_col":2,"end_col":12}]}},{"type":"drain_dirty","expected_indices":[0,1,2,3,4,5,6,7,8,9]}]}
