{"schema_version":1,"name":"styles-wide-combining-cursor","initial_size":{"rows":3,"cols":12},"events":[{"type":"drain_dirty","expected_indices":[0,1,2]},{"type":"feed","hex":"1b5b313b31481b5b313b333b343b33383b323b313b323b333b34383b353b346d581b5b306d1b5b323b3148d790d6b0e7958c1b5b3f32356c"},{"type":"checkpoint","expected":{"rows":["X","אְ界",""],"cursor":{"row":1,"col":3,"visible":false},"alternate_screen":false,"pane_spans":[{"start_col":0,"end_col":12}]}},{"type":"drain_dirty","expected_indices":[0,1]}]}
