{"schema_version":1,"name":"primary-alternate-resize","initial_size":{"rows":4,"cols":8},"events":[{"type":"drain_dirty","expected_indices":[0,1,2,3]},{"type":"feed","hex":"d790d791d792d793d794d795d796d797d798"},{"type":"feed","hex":"1b5b3f31303439681b5b333b3448414c54"},{"type":"checkpoint","expected":{"rows":["","","ALT",""],"cursor":{"row":2,"col":6,"visible":true},"alternate_screen":true,"pane_spans":[{"start_col":0,"end_col":8}]}},{"type":"resize","rows":5,"cols":5},{"type":"checkpoint","expected":{"rows":["","","AL","",""],"cursor":{"row":2,"col":4,"visible":true},"alternate_screen":true,"pane_spans":[{"start_col":0,"end_col":5}]}},{"type":"drain_dirty","expected_indices":[0,1,2,3,4]},{"type":"feed","hex":"1b5b3f313034396c"},{"type":"checkpoint","expected":{"rows":["אבגדה","וזחט","","",""],"cursor":{"row":1,"col":4,"visible":true},"alternate_screen":false,"pane_spans":[{"start_col":0,"end_col":5}]}}]}
